[INFO] Scanning for projects...
[INFO] 
[INFO] ---------------< com.slifesys.sagnus:sagnus-api-gateway >---------------
[INFO] Building sagnus-api-gateway 1.0.0-SNAPSHOT
[INFO]   from pom.xml
[INFO] --------------------------------[ jar ]---------------------------------
[INFO] 
[INFO] --- clean:3.3.2:clean (default-clean) @ sagnus-api-gateway ---
[INFO] Deleting D:\Projetos\2025\Sagnus\ddd\sagnus\sagnus-api-gateway\target
[INFO] 
[INFO] --- resources:3.3.1:resources (default-resources) @ sagnus-api-gateway ---
[INFO] Copying 1 resource from src\main\resources to target\classes
[INFO] Copying 0 resource from src\main\resources to target\classes
[INFO] 
[INFO] --- compiler:3.11.0:compile (default-compile) @ sagnus-api-gateway ---
[INFO] Changes detected - recompiling the module! :source
[INFO] Compiling 43 source files with javac [debug release 21] to target\classes
[INFO] /D:/Projetos/2025/Sagnus/ddd/sagnus/sagnus-api-gateway/src/main/java/com/slifesys/sagnus/security/JwtUtils.java: D:\Projetos\2025\Sagnus\ddd\sagnus\sagnus-api-gateway\src\main\java\com\slifesys\sagnus\security\JwtUtils.java uses or overrides a deprecated API.
[INFO] /D:/Projetos/2025/Sagnus/ddd/sagnus/sagnus-api-gateway/src/main/java/com/slifesys/sagnus/security/JwtUtils.java: Recompile with -Xlint:deprecation for details.
[INFO] 
[INFO] --- resources:3.3.1:testResources (default-testResources) @ sagnus-api-gateway ---
[INFO] skip non existing resourceDirectory D:\Projetos\2025\Sagnus\ddd\sagnus\sagnus-api-gateway\src\test\resources
[INFO] 
[INFO] --- compiler:3.11.0:testCompile (default-testCompile) @ sagnus-api-gateway ---
[INFO] Changes detected - recompiling the module! :dependency
[INFO] Compiling 1 source file with javac [debug release 21] to target\test-classes
[INFO] 
[INFO] --- surefire:3.2.5:test (default-test) @ sagnus-api-gateway ---
[INFO] Using auto detected provider org.apache.maven.surefire.junitplatform.JUnitPlatformProvider
[INFO] 
[INFO] -------------------------------------------------------
[INFO]  T E S T S
[INFO] -------------------------------------------------------
[INFO] Running com.slifesys.sagnus.SagnusApplicationTests
18:04:59.339 [main] INFO org.springframework.test.context.support.AnnotationConfigContextLoaderUtils -- Could not detect default configuration classes for test class [com.slifesys.sagnus.SagnusApplicationTests]: SagnusApplicationTests does not declare any static, non-private, non-final, nested classes annotated with @Configuration.
18:04:59.773 [main] INFO org.springframework.boot.test.context.SpringBootTestContextBootstrapper -- Found @SpringBootConfiguration com.slifesys.sagnus.SagnusApplication for test class com.slifesys.sagnus.SagnusApplicationTests

  .   ____          _            __ _ _
 /\\ / ___'_ __ _ _(_)_ __  __ _ \ \ \ \
( ( )\___ | '_ | '_| | '_ \/ _` | \ \ \ \
 \\/  ___)| |_)| | | | | || (_| |  ) ) ) )
  '  |____| .__|_| |_|_| |_\__, | / / / /
 =========|_|==============|___/=/_/_/_/

 :: Spring Boot ::                (v3.3.4)

2025-12-31 18:05:01.341 DEBUG [background-preinit] org.jboss.logging - [cid:] Logging Provider: org.jboss.logging.Slf4jLoggerProvider found via system property
2025-12-31 18:05:01.398 INFO  [main] c.s.sagnus.SagnusApplicationTests - [cid:] Starting SagnusApplicationTests using Java 21.0.9 with PID 24424 (started by slifebr in D:\Projetos\2025\Sagnus\ddd\sagnus\sagnus-api-gateway)
2025-12-31 18:05:01.403 DEBUG [main] c.s.sagnus.SagnusApplicationTests - [cid:] Running with Spring Boot v3.3.4, Spring v6.1.13
2025-12-31 18:05:01.403 INFO  [main] c.s.sagnus.SagnusApplicationTests - [cid:] No active profile set, falling back to 1 default profile: "default"
2025-12-31 18:05:04.399 INFO  [main] o.s.d.r.c.RepositoryConfigurationDelegate - [cid:] Bootstrapping Spring Data JPA repositories in DEFAULT mode.
2025-12-31 18:05:04.505 INFO  [main] o.s.d.r.c.RepositoryConfigurationDelegate - [cid:] Finished Spring Data repository scanning in 92 ms. Found 4 JPA repository interfaces.
2025-12-31 18:05:06.467 DEBUG [main] com.zaxxer.hikari.HikariConfig - [cid:] Driver class org.postgresql.Driver found in Thread context class loader jdk.internal.loader.ClassLoaders$AppClassLoader@70dea4e
2025-12-31 18:05:06.930 DEBUG [main] o.f.c.i.s.classpath.ClassPathScanner - [cid:] Scanning for classpath resources at 'classpath:db/callback' ...
2025-12-31 18:05:06.930 DEBUG [main] o.f.c.i.s.classpath.ClassPathScanner - [cid:] Determining location urls for classpath:db/callback using ClassLoader jdk.internal.loader.ClassLoaders$AppClassLoader@70dea4e ...
2025-12-31 18:05:06.930 DEBUG [main] o.f.c.i.s.classpath.ClassPathScanner - [cid:] Unable to resolve location classpath:db/callback.
2025-12-31 18:05:06.931 DEBUG [main] o.f.c.i.s.classpath.ClassPathScanner - [cid:] Scanning for classpath resources at 'classpath:db/migration' ...
2025-12-31 18:05:06.931 DEBUG [main] o.f.c.i.s.classpath.ClassPathScanner - [cid:] Determining location urls for classpath:db/migration using ClassLoader jdk.internal.loader.ClassLoaders$AppClassLoader@70dea4e ...
2025-12-31 18:05:06.954 DEBUG [main] o.f.c.i.s.classpath.ClassPathScanner - [cid:] Scanning URL: jar:file:/C:/Users/User/.m2/repository/com/slifesys/sagnus/sagnus-bc-auth/1.0.0-SNAPSHOT/sagnus-bc-auth-1.0.0-SNAPSHOT.jar!/db/migration
2025-12-31 18:05:06.968 DEBUG [main] o.f.c.i.s.classpath.ClassPathScanner - [cid:] Scanning URL: jar:file:/C:/Users/User/.m2/repository/com/slifesys/sagnus/sagnus-bc-corp/1.0.0-SNAPSHOT/sagnus-bc-corp-1.0.0-SNAPSHOT.jar!/db/migration
2025-12-31 18:05:06.969 DEBUG [main] o.f.c.i.s.classpath.ClassPathScanner - [cid:] Scanning URL: jar:file:/C:/Users/User/.m2/repository/com/slifesys/sagnus/sagnus-bc-nfe/1.0.0-SNAPSHOT/sagnus-bc-nfe-1.0.0-SNAPSHOT.jar!/db/migration
2025-12-31 18:05:06.971 DEBUG [main] o.f.c.i.s.classpath.ClassPathScanner - [cid:] Found resource: db/migration/
2025-12-31 18:05:06.971 DEBUG [main] o.f.c.i.s.classpath.ClassPathScanner - [cid:] Found resource: db/migration/
2025-12-31 18:05:06.971 DEBUG [main] o.f.c.i.s.classpath.ClassPathScanner - [cid:] Found resource: db/migration/
2025-12-31 18:05:06.971 DEBUG [main] o.f.c.i.s.classpath.ClassPathScanner - [cid:] Found resource: db/migration/V20241231170000__auth_base.sql
2025-12-31 18:05:06.973 DEBUG [main] o.f.c.i.s.classpath.ClassPathScanner - [cid:] Found resource: db/migration/V20241231170001__auth_refresh_token.sql
2025-12-31 18:05:06.973 DEBUG [main] o.f.c.i.s.classpath.ClassPathScanner - [cid:] Found resource: db/migration/V20241231171000__init_corp_schema.sql
2025-12-31 18:05:06.973 DEBUG [main] o.f.c.i.s.classpath.ClassPathScanner - [cid:] Found resource: db/migration/V20241231172000__create_nfe_audit_event.sql
2025-12-31 18:05:06.973 DEBUG [main] o.f.c.i.s.classpath.ClassPathScanner - [cid:] Found resource: db/migration/V20241231172001__create_nfe_inbox_processed.sql
2025-12-31 18:05:06.973 DEBUG [main] o.f.c.i.s.classpath.ClassPathScanner - [cid:] Found resource: db/migration/V20241231172002__create_nfe_outbox_event.sql
2025-12-31 18:05:06.973 DEBUG [main] o.f.c.i.s.classpath.ClassPathScanner - [cid:] Scanning for classes at classpath:db/migration
2025-12-31 18:05:06.981 DEBUG [main] o.f.core.internal.scanner.Scanner - [cid:] Filtering out resource: db/migration/ (filename: )
2025-12-31 18:05:06.983 DEBUG [main] o.f.core.internal.scanner.Scanner - [cid:] Filtering out resource: db/migration/ (filename: )
2025-12-31 18:05:06.983 DEBUG [main] o.f.core.internal.scanner.Scanner - [cid:] Filtering out resource: db/migration/ (filename: )
2025-12-31 18:05:06.983 DEBUG [main] o.f.c.i.r.ResourceNameValidator - [cid:] Validating V20241231172002__create_nfe_outbox_event.sql
2025-12-31 18:05:06.994 DEBUG [main] com.zaxxer.hikari.HikariConfig - [cid:] HikariPool-1 - configuration:
2025-12-31 18:05:07.082 DEBUG [main] com.zaxxer.hikari.HikariConfig - [cid:] allowPoolSuspension.............false
2025-12-31 18:05:07.083 DEBUG [main] com.zaxxer.hikari.HikariConfig - [cid:] autoCommit......................true
2025-12-31 18:05:07.085 DEBUG [main] com.zaxxer.hikari.HikariConfig - [cid:] catalog.........................none
2025-12-31 18:05:07.087 DEBUG [main] com.zaxxer.hikari.HikariConfig - [cid:] connectionInitSql...............none
2025-12-31 18:05:07.087 DEBUG [main] com.zaxxer.hikari.HikariConfig - [cid:] connectionTestQuery.............none
2025-12-31 18:05:07.089 DEBUG [main] com.zaxxer.hikari.HikariConfig - [cid:] connectionTimeout...............30000
2025-12-31 18:05:07.090 DEBUG [main] com.zaxxer.hikari.HikariConfig - [cid:] dataSource......................none
2025-12-31 18:05:07.090 DEBUG [main] com.zaxxer.hikari.HikariConfig - [cid:] dataSourceClassName.............none
2025-12-31 18:05:07.090 DEBUG [main] com.zaxxer.hikari.HikariConfig - [cid:] dataSourceJNDI..................none
2025-12-31 18:05:07.091 DEBUG [main] com.zaxxer.hikari.HikariConfig - [cid:] dataSourceProperties............{password=<masked>}
2025-12-31 18:05:07.093 DEBUG [main] com.zaxxer.hikari.HikariConfig - [cid:] driverClassName................."org.postgresql.Driver"
2025-12-31 18:05:07.093 DEBUG [main] com.zaxxer.hikari.HikariConfig - [cid:] exceptionOverrideClassName......none
2025-12-31 18:05:07.096 DEBUG [main] com.zaxxer.hikari.HikariConfig - [cid:] healthCheckProperties...........{}
2025-12-31 18:05:07.098 DEBUG [main] com.zaxxer.hikari.HikariConfig - [cid:] healthCheckRegistry.............none
2025-12-31 18:05:07.099 DEBUG [main] com.zaxxer.hikari.HikariConfig - [cid:] idleTimeout.....................600000
2025-12-31 18:05:07.099 DEBUG [main] com.zaxxer.hikari.HikariConfig - [cid:] initializationFailTimeout.......1
2025-12-31 18:05:07.100 DEBUG [main] com.zaxxer.hikari.HikariConfig - [cid:] isolateInternalQueries..........false
2025-12-31 18:05:07.100 DEBUG [main] com.zaxxer.hikari.HikariConfig - [cid:] jdbcUrl.........................jdbc:postgresql://localhost:5432/sagnus
2025-12-31 18:05:07.100 DEBUG [main] com.zaxxer.hikari.HikariConfig - [cid:] keepaliveTime...................0
2025-12-31 18:05:07.100 DEBUG [main] com.zaxxer.hikari.HikariConfig - [cid:] leakDetectionThreshold..........0
2025-12-31 18:05:07.101 DEBUG [main] com.zaxxer.hikari.HikariConfig - [cid:] maxLifetime.....................1800000
2025-12-31 18:05:07.101 DEBUG [main] com.zaxxer.hikari.HikariConfig - [cid:] maximumPoolSize.................10
2025-12-31 18:05:07.102 DEBUG [main] com.zaxxer.hikari.HikariConfig - [cid:] metricRegistry..................none
2025-12-31 18:05:07.102 DEBUG [main] com.zaxxer.hikari.HikariConfig - [cid:] metricsTrackerFactory...........none
2025-12-31 18:05:07.102 DEBUG [main] com.zaxxer.hikari.HikariConfig - [cid:] minimumIdle.....................10
2025-12-31 18:05:07.103 DEBUG [main] com.zaxxer.hikari.HikariConfig - [cid:] password........................<masked>
2025-12-31 18:05:07.104 DEBUG [main] com.zaxxer.hikari.HikariConfig - [cid:] poolName........................"HikariPool-1"
2025-12-31 18:05:07.104 DEBUG [main] com.zaxxer.hikari.HikariConfig - [cid:] readOnly........................false
2025-12-31 18:05:07.104 DEBUG [main] com.zaxxer.hikari.HikariConfig - [cid:] registerMbeans..................false
2025-12-31 18:05:07.104 DEBUG [main] com.zaxxer.hikari.HikariConfig - [cid:] scheduledExecutor...............none
2025-12-31 18:05:07.104 DEBUG [main] com.zaxxer.hikari.HikariConfig - [cid:] schema..........................none
2025-12-31 18:05:07.104 DEBUG [main] com.zaxxer.hikari.HikariConfig - [cid:] threadFactory...................internal
2025-12-31 18:05:07.106 DEBUG [main] com.zaxxer.hikari.HikariConfig - [cid:] transactionIsolation............default
2025-12-31 18:05:07.106 DEBUG [main] com.zaxxer.hikari.HikariConfig - [cid:] username........................"sagnus"
2025-12-31 18:05:07.106 DEBUG [main] com.zaxxer.hikari.HikariConfig - [cid:] validationTimeout...............5000
2025-12-31 18:05:07.106 INFO  [main] com.zaxxer.hikari.HikariDataSource - [cid:] HikariPool-1 - Starting...
2025-12-31 18:05:07.169 DEBUG [main] org.postgresql.Driver - [cid:] Loading driver configuration via classloader jdk.internal.loader.ClassLoaders$AppClassLoader@70dea4e
2025-12-31 18:05:07.169 DEBUG [main] org.postgresql.Driver - [cid:] Connecting with URL: jdbc:postgresql://localhost:5432/sagnus
2025-12-31 18:05:07.195 DEBUG [main] org.postgresql.jdbc.PgConnection - [cid:] PostgreSQL JDBC Driver 42.7.4
2025-12-31 18:05:07.197 DEBUG [main] org.postgresql.jdbc.PgConnection - [cid:]   setDefaultFetchSize = 0
2025-12-31 18:05:07.197 DEBUG [main] org.postgresql.jdbc.PgConnection - [cid:]   setPrepareThreshold = 5
2025-12-31 18:05:07.212 DEBUG [main] o.p.core.v3.ConnectionFactoryImpl - [cid:] Trying to establish a protocol version 3 connection to localhost:5432
2025-12-31 18:05:07.302 DEBUG [main] o.p.core.v3.ConnectionFactoryImpl - [cid:] Receive Buffer Size is 65치536
2025-12-31 18:05:07.303 DEBUG [main] o.p.core.v3.ConnectionFactoryImpl - [cid:] Send Buffer Size is 64치512
2025-12-31 18:05:07.856 INFO  [main] com.zaxxer.hikari.pool.HikariPool - [cid:] HikariPool-1 - Added connection org.postgresql.jdbc.PgConnection@15d58530
2025-12-31 18:05:07.860 INFO  [main] com.zaxxer.hikari.HikariDataSource - [cid:] HikariPool-1 - Start completed.
2025-12-31 18:05:07.940 DEBUG [main] o.f.c.i.r.ResourceNameValidator - [cid:] Validating V20241231171000__init_corp_schema.sql
2025-12-31 18:05:07.940 DEBUG [main] o.f.c.i.r.ResourceNameValidator - [cid:] Validating V20241231170001__auth_refresh_token.sql
2025-12-31 18:05:07.940 DEBUG [main] o.f.c.i.r.ResourceNameValidator - [cid:] Validating V20241231172000__create_nfe_audit_event.sql
2025-12-31 18:05:07.940 DEBUG [main] o.f.c.i.r.ResourceNameValidator - [cid:] Validating V20241231172001__create_nfe_inbox_processed.sql
2025-12-31 18:05:07.940 DEBUG [main] o.f.c.i.r.ResourceNameValidator - [cid:] Validating V20241231170000__auth_base.sql
2025-12-31 18:05:07.954 INFO  [main] org.flywaydb.core.FlywayExecutor - [cid:] Database: jdbc:postgresql://localhost:5432/sagnus (PostgreSQL 18.1)
2025-12-31 18:05:07.954 DEBUG [main] org.flywaydb.core.FlywayExecutor - [cid:] Driver: PostgreSQL JDBC Driver 42.7.4
2025-12-31 18:05:07.957 DEBUG [main] org.flywaydb.core.FlywayExecutor - [cid:] DDL Transactions Supported: true
2025-12-31 18:05:07.958 DEBUG [main] o.f.c.i.s.SchemaHistoryFactory - [cid:] Schemas: 
2025-12-31 18:05:07.962 DEBUG [main] o.f.c.i.s.SchemaHistoryFactory - [cid:] Default schema: null
2025-12-31 18:05:08.004 DEBUG [HikariPool-1 housekeeper] com.zaxxer.hikari.pool.HikariPool - [cid:] HikariPool-1 - Pool stats (total=1, active=1, idle=0, waiting=0)
2025-12-31 18:05:08.017 WARN  [main] o.f.c.i.database.base.Database - [cid:] Flyway upgrade recommended: PostgreSQL 18.1 is newer than this version of Flyway and support has not been tested. The latest supported version of PostgreSQL is 16.
2025-12-31 18:05:08.020 DEBUG [main] o.f.c.i.c.SqlScriptCallbackFactory - [cid:] Scanning for SQL callbacks ...
2025-12-31 18:05:08.020 DEBUG [main] o.f.core.internal.scanner.Scanner - [cid:] Filtering out resource: db/migration/ (filename: )
2025-12-31 18:05:08.020 DEBUG [main] o.f.core.internal.scanner.Scanner - [cid:] Filtering out resource: db/migration/ (filename: )
2025-12-31 18:05:08.020 DEBUG [main] o.f.core.internal.scanner.Scanner - [cid:] Filtering out resource: db/migration/ (filename: )
2025-12-31 18:05:08.038 DEBUG [main] o.f.core.internal.command.DbValidate - [cid:] Validating migrations ...
2025-12-31 18:05:08.041 DEBUG [main] org.postgresql.jdbc.PgConnection - [cid:]   setAutoCommit = false
2025-12-31 18:05:08.046 DEBUG [main] o.f.c.a.c.ClassicConfiguration - [cid:] CherryPickConfigurationExtension not found
2025-12-31 18:05:08.048 DEBUG [main] o.f.core.internal.scanner.Scanner - [cid:] Filtering out resource: db/migration/ (filename: )
2025-12-31 18:05:08.048 DEBUG [main] o.f.core.internal.scanner.Scanner - [cid:] Filtering out resource: db/migration/ (filename: )
2025-12-31 18:05:08.048 DEBUG [main] o.f.core.internal.scanner.Scanner - [cid:] Filtering out resource: db/migration/ (filename: )
2025-12-31 18:05:08.079 DEBUG [main] o.f.core.internal.scanner.Scanner - [cid:] Filtering out resource: db/migration/V20241231172002__create_nfe_outbox_event.sql (filename: V20241231172002__create_nfe_outbox_event.sql)
2025-12-31 18:05:08.079 DEBUG [main] o.f.core.internal.scanner.Scanner - [cid:] Filtering out resource: db/migration/V20241231171000__init_corp_schema.sql (filename: V20241231171000__init_corp_schema.sql)
2025-12-31 18:05:08.079 DEBUG [main] o.f.core.internal.scanner.Scanner - [cid:] Filtering out resource: db/migration/ (filename: )
2025-12-31 18:05:08.080 DEBUG [main] o.f.core.internal.scanner.Scanner - [cid:] Filtering out resource: db/migration/ (filename: )
2025-12-31 18:05:08.080 DEBUG [main] o.f.core.internal.scanner.Scanner - [cid:] Filtering out resource: db/migration/V20241231170001__auth_refresh_token.sql (filename: V20241231170001__auth_refresh_token.sql)
2025-12-31 18:05:08.080 DEBUG [main] o.f.core.internal.scanner.Scanner - [cid:] Filtering out resource: db/migration/ (filename: )
2025-12-31 18:05:08.080 DEBUG [main] o.f.core.internal.scanner.Scanner - [cid:] Filtering out resource: db/migration/V20241231172000__create_nfe_audit_event.sql (filename: V20241231172000__create_nfe_audit_event.sql)
2025-12-31 18:05:08.080 DEBUG [main] o.f.core.internal.scanner.Scanner - [cid:] Filtering out resource: db/migration/V20241231172001__create_nfe_inbox_processed.sql (filename: V20241231172001__create_nfe_inbox_processed.sql)
2025-12-31 18:05:08.080 DEBUG [main] o.f.core.internal.scanner.Scanner - [cid:] Filtering out resource: db/migration/V20241231170000__auth_base.sql (filename: V20241231170000__auth_base.sql)
2025-12-31 18:05:08.081 DEBUG [main] o.f.core.internal.scanner.Scanner - [cid:] Filtering out resource: db/migration/V20241231172002__create_nfe_outbox_event.sql (filename: V20241231172002__create_nfe_outbox_event.sql)
2025-12-31 18:05:08.081 DEBUG [main] o.f.core.internal.scanner.Scanner - [cid:] Filtering out resource: db/migration/V20241231171000__init_corp_schema.sql (filename: V20241231171000__init_corp_schema.sql)
2025-12-31 18:05:08.082 DEBUG [main] o.f.core.internal.scanner.Scanner - [cid:] Filtering out resource: db/migration/ (filename: )
2025-12-31 18:05:08.082 DEBUG [main] o.f.core.internal.scanner.Scanner - [cid:] Filtering out resource: db/migration/ (filename: )
2025-12-31 18:05:08.082 DEBUG [main] o.f.core.internal.scanner.Scanner - [cid:] Filtering out resource: db/migration/V20241231170001__auth_refresh_token.sql (filename: V20241231170001__auth_refresh_token.sql)
2025-12-31 18:05:08.082 DEBUG [main] o.f.core.internal.scanner.Scanner - [cid:] Filtering out resource: db/migration/ (filename: )
2025-12-31 18:05:08.082 DEBUG [main] o.f.core.internal.scanner.Scanner - [cid:] Filtering out resource: db/migration/V20241231172000__create_nfe_audit_event.sql (filename: V20241231172000__create_nfe_audit_event.sql)
2025-12-31 18:05:08.082 DEBUG [main] o.f.core.internal.scanner.Scanner - [cid:] Filtering out resource: db/migration/V20241231172001__create_nfe_inbox_processed.sql (filename: V20241231172001__create_nfe_inbox_processed.sql)
2025-12-31 18:05:08.082 DEBUG [main] o.f.core.internal.scanner.Scanner - [cid:] Filtering out resource: db/migration/V20241231170000__auth_base.sql (filename: V20241231170000__auth_base.sql)
2025-12-31 18:05:08.089 DEBUG [HikariPool-1 connection adder] org.postgresql.Driver - [cid:] Connecting with URL: jdbc:postgresql://localhost:5432/sagnus
2025-12-31 18:05:08.091 DEBUG [HikariPool-1 connection adder] org.postgresql.jdbc.PgConnection - [cid:] PostgreSQL JDBC Driver 42.7.4
2025-12-31 18:05:08.092 DEBUG [HikariPool-1 connection adder] org.postgresql.jdbc.PgConnection - [cid:]   setDefaultFetchSize = 0
2025-12-31 18:05:08.093 DEBUG [HikariPool-1 connection adder] org.postgresql.jdbc.PgConnection - [cid:]   setPrepareThreshold = 5
2025-12-31 18:05:08.093 DEBUG [HikariPool-1 connection adder] o.p.core.v3.ConnectionFactoryImpl - [cid:] Trying to establish a protocol version 3 connection to localhost:5432
2025-12-31 18:05:08.095 DEBUG [HikariPool-1 connection adder] o.p.core.v3.ConnectionFactoryImpl - [cid:] Receive Buffer Size is 65치536
2025-12-31 18:05:08.100 DEBUG [HikariPool-1 connection adder] o.p.core.v3.ConnectionFactoryImpl - [cid:] Send Buffer Size is 64치512
2025-12-31 18:05:08.150 DEBUG [main] org.postgresql.jdbc.PgConnection - [cid:]   setAutoCommit = true
2025-12-31 18:05:08.154 DEBUG [main] org.postgresql.jdbc.PgConnection - [cid:]   setAutoCommit = false
2025-12-31 18:05:08.155 DEBUG [main] org.postgresql.jdbc.PgConnection - [cid:]   setAutoCommit = true
2025-12-31 18:05:08.161 DEBUG [main] org.flywaydb.core.FlywayExecutor - [cid:] Memory usage: 64 of 94M
2025-12-31 18:05:08.161 WARN  [main] o.s.w.c.s.GenericWebApplicationContext - [cid:] Exception encountered during context initialization - cancelling refresh attempt: org.springframework.beans.factory.BeanCreationException: Error creating bean with name 'entityManagerFactory' defined in class path resource [org/springframework/boot/autoconfigure/orm/jpa/HibernateJpaConfiguration.class]: Failed to initialize dependency 'flywayInitializer' of LoadTimeWeaverAware bean 'entityManagerFactory': Error creating bean with name 'flywayInitializer' defined in class path resource [org/springframework/boot/autoconfigure/flyway/FlywayAutoConfiguration$FlywayConfiguration.class]: Validate failed: Migrations have failed validation
Detected applied migration not resolved locally: 1.
If you removed this migration intentionally, run repair to mark the migration as deleted.
Need more flexibility with validation rules? Learn more: https://rd.gt/3AbJUZE
2025-12-31 18:05:08.161 INFO  [main] com.zaxxer.hikari.HikariDataSource - [cid:] HikariPool-1 - Shutdown initiated...
2025-12-31 18:05:08.161 DEBUG [main] com.zaxxer.hikari.pool.HikariPool - [cid:] HikariPool-1 - Before shutdown stats (total=1, active=0, idle=1, waiting=0)
2025-12-31 18:05:08.194 DEBUG [HikariPool-1 connection closer] com.zaxxer.hikari.pool.PoolBase - [cid:] HikariPool-1 - Closing connection org.postgresql.jdbc.PgConnection@15d58530: (connection evicted)
2025-12-31 18:05:08.329 DEBUG [HikariPool-1 connection adder] com.zaxxer.hikari.pool.HikariPool - [cid:] HikariPool-1 - Added connection org.postgresql.jdbc.PgConnection@5ce93240
2025-12-31 18:05:08.360 DEBUG [HikariPool-1 connection adder] com.zaxxer.hikari.pool.HikariPool - [cid:] HikariPool-1 - After adding stats (total=1, active=0, idle=1, waiting=0)
2025-12-31 18:05:08.360 DEBUG [HikariPool-1 connection adder] com.zaxxer.hikari.pool.HikariPool - [cid:] HikariPool-1 - Connection not added, stats (total=1, active=0, idle=1, waiting=0)
2025-12-31 18:05:08.360 DEBUG [HikariPool-1 connection adder] com.zaxxer.hikari.pool.HikariPool - [cid:] HikariPool-1 - Connection not added, stats (total=1, active=0, idle=1, waiting=0)
2025-12-31 18:05:08.360 DEBUG [HikariPool-1 connection adder] com.zaxxer.hikari.pool.HikariPool - [cid:] HikariPool-1 - Connection not added, stats (total=1, active=0, idle=1, waiting=0)
2025-12-31 18:05:08.360 DEBUG [HikariPool-1 connection adder] com.zaxxer.hikari.pool.HikariPool - [cid:] HikariPool-1 - Connection not added, stats (total=1, active=0, idle=1, waiting=0)
2025-12-31 18:05:08.360 DEBUG [HikariPool-1 connection adder] com.zaxxer.hikari.pool.HikariPool - [cid:] HikariPool-1 - Connection not added, stats (total=1, active=0, idle=1, waiting=0)
2025-12-31 18:05:08.360 DEBUG [HikariPool-1 connection adder] com.zaxxer.hikari.pool.HikariPool - [cid:] HikariPool-1 - Connection not added, stats (total=1, active=0, idle=1, waiting=0)
2025-12-31 18:05:08.360 DEBUG [HikariPool-1 connection adder] com.zaxxer.hikari.pool.HikariPool - [cid:] HikariPool-1 - Connection not added, stats (total=1, active=0, idle=1, waiting=0)
2025-12-31 18:05:08.360 DEBUG [HikariPool-1 connection adder] com.zaxxer.hikari.pool.HikariPool - [cid:] HikariPool-1 - Connection not added, stats (total=1, active=0, idle=1, waiting=0)
2025-12-31 18:05:08.360 DEBUG [HikariPool-1 connection adder] com.zaxxer.hikari.pool.HikariPool - [cid:] HikariPool-1 - Connection not added, stats (total=1, active=0, idle=1, waiting=0)
2025-12-31 18:05:08.366 DEBUG [HikariPool-1 connection closer] com.zaxxer.hikari.pool.PoolBase - [cid:] HikariPool-1 - Closing connection org.postgresql.jdbc.PgConnection@5ce93240: (connection evicted)
2025-12-31 18:05:08.366 DEBUG [main] com.zaxxer.hikari.pool.HikariPool - [cid:] HikariPool-1 - After shutdown stats (total=0, active=0, idle=0, waiting=0)
2025-12-31 18:05:08.366 INFO  [main] com.zaxxer.hikari.HikariDataSource - [cid:] HikariPool-1 - Shutdown completed.
2025-12-31 18:05:08.394 INFO  [main] o.s.b.a.l.ConditionEvaluationReportLogger - [cid:] 

Error starting ApplicationContext. To display the condition evaluation report re-run your application with 'debug' enabled.
2025-12-31 18:05:08.469 ERROR [main] o.s.boot.SpringApplication - [cid:] Application run failed
org.springframework.beans.factory.BeanCreationException: Error creating bean with name 'entityManagerFactory' defined in class path resource [org/springframework/boot/autoconfigure/orm/jpa/HibernateJpaConfiguration.class]: Failed to initialize dependency 'flywayInitializer' of LoadTimeWeaverAware bean 'entityManagerFactory': Error creating bean with name 'flywayInitializer' defined in class path resource [org/springframework/boot/autoconfigure/flyway/FlywayAutoConfiguration$FlywayConfiguration.class]: Validate failed: Migrations have failed validation
Detected applied migration not resolved locally: 1.
If you removed this migration intentionally, run repair to mark the migration as deleted.
Need more flexibility with validation rules? Learn more: https://rd.gt/3AbJUZE
	at org.springframework.beans.factory.support.AbstractBeanFactory.doGetBean(AbstractBeanFactory.java:326)
	at org.springframework.beans.factory.support.AbstractBeanFactory.getBean(AbstractBeanFactory.java:205)
	at org.springframework.context.support.AbstractApplicationContext.finishBeanFactoryInitialization(AbstractApplicationContext.java:954)
	at org.springframework.context.support.AbstractApplicationContext.refresh(AbstractApplicationContext.java:625)
	at org.springframework.boot.SpringApplication.refresh(SpringApplication.java:754)
	at org.springframework.boot.SpringApplication.refreshContext(SpringApplication.java:456)
	at org.springframework.boot.SpringApplication.run(SpringApplication.java:335)
	at org.springframework.boot.test.context.SpringBootContextLoader.lambda$loadContext$3(SpringBootContextLoader.java:137)
	at org.springframework.util.function.ThrowingSupplier.get(ThrowingSupplier.java:58)
	at org.springframework.util.function.ThrowingSupplier.get(ThrowingSupplier.java:46)
	at org.springframework.boot.SpringApplication.withHook(SpringApplication.java:1463)
	at org.springframework.boot.test.context.SpringBootContextLoader$ContextLoaderHook.run(SpringBootContextLoader.java:553)
	at org.springframework.boot.test.context.SpringBootContextLoader.loadContext(SpringBootContextLoader.java:137)
	at org.springframework.boot.test.context.SpringBootContextLoader.loadContext(SpringBootContextLoader.java:108)
	at org.springframework.test.context.cache.DefaultCacheAwareContextLoaderDelegate.loadContextInternal(DefaultCacheAwareContextLoaderDelegate.java:225)
	at org.springframework.test.context.cache.DefaultCacheAwareContextLoaderDelegate.loadContext(DefaultCacheAwareContextLoaderDelegate.java:152)
	at org.springframework.test.context.support.DefaultTestContext.getApplicationContext(DefaultTestContext.java:130)
	at org.springframework.test.context.web.ServletTestExecutionListener.setUpRequestContextIfNecessary(ServletTestExecutionListener.java:191)
	at org.springframework.test.context.web.ServletTestExecutionListener.prepareTestInstance(ServletTestExecutionListener.java:130)
	at org.springframework.test.context.TestContextManager.prepareTestInstance(TestContextManager.java:260)
	at org.springframework.test.context.junit.jupiter.SpringExtension.postProcessTestInstance(SpringExtension.java:163)
	at org.junit.jupiter.engine.descriptor.ClassBasedTestDescriptor.lambda$invokeTestInstancePostProcessors$10(ClassBasedTestDescriptor.java:378)
	at org.junit.jupiter.engine.descriptor.ClassBasedTestDescriptor.executeAndMaskThrowable(ClassBasedTestDescriptor.java:383)
	at org.junit.jupiter.engine.descriptor.ClassBasedTestDescriptor.lambda$invokeTestInstancePostProcessors$11(ClassBasedTestDescriptor.java:378)
	at java.base/java.util.stream.ReferencePipeline$3$1.accept(ReferencePipeline.java:197)
	at java.base/java.util.stream.ReferencePipeline$2$1.accept(ReferencePipeline.java:179)
	at java.base/java.util.ArrayList$ArrayListSpliterator.forEachRemaining(ArrayList.java:1708)
	at java.base/java.util.stream.AbstractPipeline.copyInto(AbstractPipeline.java:509)
	at java.base/java.util.stream.AbstractPipeline.wrapAndCopyInto(AbstractPipeline.java:499)
	at java.base/java.util.stream.StreamSpliterators$WrappingSpliterator.forEachRemaining(StreamSpliterators.java:310)
	at java.base/java.util.stream.Streams$ConcatSpliterator.forEachRemaining(Streams.java:735)
	at java.base/java.util.stream.Streams$ConcatSpliterator.forEachRemaining(Streams.java:734)
	at java.base/java.util.stream.ReferencePipeline$Head.forEach(ReferencePipeline.java:762)
	at org.junit.jupiter.engine.descriptor.ClassBasedTestDescriptor.invokeTestInstancePostProcessors(ClassBasedTestDescriptor.java:377)
	at org.junit.jupiter.engine.descriptor.ClassBasedTestDescriptor.lambda$instantiateAndPostProcessTestInstance$6(ClassBasedTestDescriptor.java:290)
	at org.junit.platform.engine.support.hierarchical.ThrowableCollector.execute(ThrowableCollector.java:73)
	at org.junit.jupiter.engine.descriptor.ClassBasedTestDescriptor.instantiateAndPostProcessTestInstance(ClassBasedTestDescriptor.java:289)
	at org.junit.jupiter.engine.descriptor.ClassBasedTestDescriptor.lambda$testInstancesProvider$4(ClassBasedTestDescriptor.java:279)
	at java.base/java.util.Optional.orElseGet(Optional.java:364)
	at org.junit.jupiter.engine.descriptor.ClassBasedTestDescriptor.lambda$testInstancesProvider$5(ClassBasedTestDescriptor.java:278)
	at org.junit.jupiter.engine.execution.TestInstancesProvider.getTestInstances(TestInstancesProvider.java:31)
	at org.junit.jupiter.engine.descriptor.TestMethodTestDescriptor.lambda$prepare$0(TestMethodTestDescriptor.java:106)
	at org.junit.platform.engine.support.hierarchical.ThrowableCollector.execute(ThrowableCollector.java:73)
	at org.junit.jupiter.engine.descriptor.TestMethodTestDescriptor.prepare(TestMethodTestDescriptor.java:105)
	at org.junit.jupiter.engine.descriptor.TestMethodTestDescriptor.prepare(TestMethodTestDescriptor.java:69)
	at org.junit.platform.engine.support.hierarchical.NodeTestTask.lambda$prepare$2(NodeTestTask.java:123)
	at org.junit.platform.engine.support.hierarchical.ThrowableCollector.execute(ThrowableCollector.java:73)
	at org.junit.platform.engine.support.hierarchical.NodeTestTask.prepare(NodeTestTask.java:123)
	at org.junit.platform.engine.support.hierarchical.NodeTestTask.execute(NodeTestTask.java:90)
	at java.base/java.util.ArrayList.forEach(ArrayList.java:1596)
	at org.junit.platform.engine.support.hierarchical.SameThreadHierarchicalTestExecutorService.invokeAll(SameThreadHierarchicalTestExecutorService.java:41)
	at org.junit.platform.engine.support.hierarchical.NodeTestTask.lambda$executeRecursively$6(NodeTestTask.java:155)
	at org.junit.platform.engine.support.hierarchical.ThrowableCollector.execute(ThrowableCollector.java:73)
	at org.junit.platform.engine.support.hierarchical.NodeTestTask.lambda$executeRecursively$8(NodeTestTask.java:141)
	at org.junit.platform.engine.support.hierarchical.Node.around(Node.java:137)
	at org.junit.platform.engine.support.hierarchical.NodeTestTask.lambda$executeRecursively$9(NodeTestTask.java:139)
	at org.junit.platform.engine.support.hierarchical.ThrowableCollector.execute(ThrowableCollector.java:73)
	at org.junit.platform.engine.support.hierarchical.NodeTestTask.executeRecursively(NodeTestTask.java:138)
	at org.junit.platform.engine.support.hierarchical.NodeTestTask.execute(NodeTestTask.java:95)
	at java.base/java.util.ArrayList.forEach(ArrayList.java:1596)
	at org.junit.platform.engine.support.hierarchical.SameThreadHierarchicalTestExecutorService.invokeAll(SameThreadHierarchicalTestExecutorService.java:41)
	at org.junit.platform.engine.support.hierarchical.NodeTestTask.lambda$executeRecursively$6(NodeTestTask.java:155)
	at org.junit.platform.engine.support.hierarchical.ThrowableCollector.execute(ThrowableCollector.java:73)
	at org.junit.platform.engine.support.hierarchical.NodeTestTask.lambda$executeRecursively$8(NodeTestTask.java:141)
	at org.junit.platform.engine.support.hierarchical.Node.around(Node.java:137)
	at org.junit.platform.engine.support.hierarchical.NodeTestTask.lambda$executeRecursively$9(NodeTestTask.java:139)
	at org.junit.platform.engine.support.hierarchical.ThrowableCollector.execute(ThrowableCollector.java:73)
	at org.junit.platform.engine.support.hierarchical.NodeTestTask.executeRecursively(NodeTestTask.java:138)
	at org.junit.platform.engine.support.hierarchical.NodeTestTask.execute(NodeTestTask.java:95)
	at org.junit.platform.engine.support.hierarchical.SameThreadHierarchicalTestExecutorService.submit(SameThreadHierarchicalTestExecutorService.java:35)
	at org.junit.platform.engine.support.hierarchical.HierarchicalTestExecutor.execute(HierarchicalTestExecutor.java:57)
	at org.junit.platform.engine.support.hierarchical.HierarchicalTestEngine.execute(HierarchicalTestEngine.java:54)
	at org.junit.platform.launcher.core.EngineExecutionOrchestrator.execute(EngineExecutionOrchestrator.java:198)
	at org.junit.platform.launcher.core.EngineExecutionOrchestrator.execute(EngineExecutionOrchestrator.java:169)
	at org.junit.platform.launcher.core.EngineExecutionOrchestrator.execute(EngineExecutionOrchestrator.java:93)
	at org.junit.platform.launcher.core.EngineExecutionOrchestrator.lambda$execute$0(EngineExecutionOrchestrator.java:58)
	at org.junit.platform.launcher.core.EngineExecutionOrchestrator.withInterceptedStreams(EngineExecutionOrchestrator.java:141)
	at org.junit.platform.launcher.core.EngineExecutionOrchestrator.execute(EngineExecutionOrchestrator.java:57)
	at org.junit.platform.launcher.core.DefaultLauncher.execute(DefaultLauncher.java:103)
	at org.junit.platform.launcher.core.DefaultLauncher.execute(DefaultLauncher.java:85)
	at org.junit.platform.launcher.core.DelegatingLauncher.execute(DelegatingLauncher.java:47)
	at org.apache.maven.surefire.junitplatform.LazyLauncher.execute(LazyLauncher.java:56)
	at org.apache.maven.surefire.junitplatform.JUnitPlatformProvider.execute(JUnitPlatformProvider.java:184)
	at org.apache.maven.surefire.junitplatform.JUnitPlatformProvider.invokeAllTests(JUnitPlatformProvider.java:148)
	at org.apache.maven.surefire.junitplatform.JUnitPlatformProvider.invoke(JUnitPlatformProvider.java:122)
	at org.apache.maven.surefire.booter.ForkedBooter.runSuitesInProcess(ForkedBooter.java:385)
	at org.apache.maven.surefire.booter.ForkedBooter.execute(ForkedBooter.java:162)
	at org.apache.maven.surefire.booter.ForkedBooter.run(ForkedBooter.java:507)
	at org.apache.maven.surefire.booter.ForkedBooter.main(ForkedBooter.java:495)
Caused by: org.springframework.beans.factory.BeanCreationException: Error creating bean with name 'flywayInitializer' defined in class path resource [org/springframework/boot/autoconfigure/flyway/FlywayAutoConfiguration$FlywayConfiguration.class]: Validate failed: Migrations have failed validation
Detected applied migration not resolved locally: 1.
If you removed this migration intentionally, run repair to mark the migration as deleted.
Need more flexibility with validation rules? Learn more: https://rd.gt/3AbJUZE
	at org.springframework.beans.factory.support.AbstractAutowireCapableBeanFactory.initializeBean(AbstractAutowireCapableBeanFactory.java:1806)
	at org.springframework.beans.factory.support.AbstractAutowireCapableBeanFactory.doCreateBean(AbstractAutowireCapableBeanFactory.java:600)
	at org.springframework.beans.factory.support.AbstractAutowireCapableBeanFactory.createBean(AbstractAutowireCapableBeanFactory.java:522)
	at org.springframework.beans.factory.support.AbstractBeanFactory.lambda$doGetBean$0(AbstractBeanFactory.java:337)
	at org.springframework.beans.factory.support.DefaultSingletonBeanRegistry.getSingleton(DefaultSingletonBeanRegistry.java:234)
	at org.springframework.beans.factory.support.AbstractBeanFactory.doGetBean(AbstractBeanFactory.java:335)
	at org.springframework.beans.factory.support.AbstractBeanFactory.getBean(AbstractBeanFactory.java:200)
	at org.springframework.beans.factory.support.AbstractBeanFactory.doGetBean(AbstractBeanFactory.java:313)
	... 88 common frames omitted
Caused by: org.flywaydb.core.api.exception.FlywayValidateException: Validate failed: Migrations have failed validation
Detected applied migration not resolved locally: 1.
If you removed this migration intentionally, run repair to mark the migration as deleted.
Need more flexibility with validation rules? Learn more: https://rd.gt/3AbJUZE
	at org.flywaydb.core.Flyway.lambda$migrate$0(Flyway.java:160)
	at org.flywaydb.core.FlywayExecutor.execute(FlywayExecutor.java:205)
	at org.flywaydb.core.Flyway.migrate(Flyway.java:147)
	at org.springframework.boot.autoconfigure.flyway.FlywayMigrationInitializer.afterPropertiesSet(FlywayMigrationInitializer.java:66)
	at org.springframework.beans.factory.support.AbstractAutowireCapableBeanFactory.invokeInitMethods(AbstractAutowireCapableBeanFactory.java:1853)
	at org.springframework.beans.factory.support.AbstractAutowireCapableBeanFactory.initializeBean(AbstractAutowireCapableBeanFactory.java:1802)
	... 95 common frames omitted



============================
CONDITIONS EVALUATION REPORT
============================


Positive matches:
-----------------

    None


Negative matches:
-----------------

    None


Exclusions:
-----------

    None


Unconditional classes:
----------------------

    None



2025-12-31 18:05:08.496 WARN  [main] o.s.test.context.TestContextManager - [cid:] Caught exception while allowing TestExecutionListener [org.springframework.test.context.web.ServletTestExecutionListener] to prepare test instance [com.slifesys.sagnus.SagnusApplicationTests@684b26b7]
java.lang.IllegalStateException: Failed to load ApplicationContext for [WebMergedContextConfiguration@2cc34cd5 testClass = com.slifesys.sagnus.SagnusApplicationTests, locations = [], classes = [com.slifesys.sagnus.SagnusApplication], contextInitializerClasses = [], activeProfiles = [], propertySourceDescriptors = [], propertySourceProperties = ["org.springframework.boot.test.context.SpringBootTestContextBootstrapper=true"], contextCustomizers = [org.springframework.boot.test.context.filter.ExcludeFilterContextCustomizer@5e3f861, org.springframework.boot.test.json.DuplicateJsonObjectContextCustomizerFactory$DuplicateJsonObjectContextCustomizer@6d5620ce, org.springframework.boot.test.mock.mockito.MockitoContextCustomizer@0, org.springframework.boot.test.web.client.TestRestTemplateContextCustomizer@3e78b6a5, org.springframework.boot.test.web.reactor.netty.DisableReactorResourceFactoryGlobalResourcesContextCustomizerFactory$DisableReactorResourceFactoryGlobalResourcesContextCustomizerCustomizer@4b8729ff, org.springframework.boot.test.autoconfigure.actuate.observability.ObservabilityContextCustomizerFactory$DisableObservabilityContextCustomizer@1f, org.springframework.boot.test.autoconfigure.properties.PropertyMappingContextCustomizer@0, org.springframework.boot.test.autoconfigure.web.servlet.WebDriverContextCustomizer@47c81abf, org.springframework.boot.test.context.SpringBootTestAnnotation@f8aaa1cc], resourceBasePath = "src/main/webapp", contextLoader = org.springframework.boot.test.context.SpringBootContextLoader, parent = null]
	at org.springframework.test.context.cache.DefaultCacheAwareContextLoaderDelegate.loadContext(DefaultCacheAwareContextLoaderDelegate.java:180)
	at org.springframework.test.context.support.DefaultTestContext.getApplicationContext(DefaultTestContext.java:130)
	at org.springframework.test.context.web.ServletTestExecutionListener.setUpRequestContextIfNecessary(ServletTestExecutionListener.java:191)
	at org.springframework.test.context.web.ServletTestExecutionListener.prepareTestInstance(ServletTestExecutionListener.java:130)
	at org.springframework.test.context.TestContextManager.prepareTestInstance(TestContextManager.java:260)
	at org.springframework.test.context.junit.jupiter.SpringExtension.postProcessTestInstance(SpringExtension.java:163)
	at org.junit.jupiter.engine.descriptor.ClassBasedTestDescriptor.lambda$invokeTestInstancePostProcessors$10(ClassBasedTestDescriptor.java:378)
	at org.junit.jupiter.engine.descriptor.ClassBasedTestDescriptor.executeAndMaskThrowable(ClassBasedTestDescriptor.java:383)
	at org.junit.jupiter.engine.descriptor.ClassBasedTestDescriptor.lambda$invokeTestInstancePostProcessors$11(ClassBasedTestDescriptor.java:378)
	at java.base/java.util.stream.ReferencePipeline$3$1.accept(ReferencePipeline.java:197)
	at java.base/java.util.stream.ReferencePipeline$2$1.accept(ReferencePipeline.java:179)
	at java.base/java.util.ArrayList$ArrayListSpliterator.forEachRemaining(ArrayList.java:1708)
	at java.base/java.util.stream.AbstractPipeline.copyInto(AbstractPipeline.java:509)
	at java.base/java.util.stream.AbstractPipeline.wrapAndCopyInto(AbstractPipeline.java:499)
	at java.base/java.util.stream.StreamSpliterators$WrappingSpliterator.forEachRemaining(StreamSpliterators.java:310)
	at java.base/java.util.stream.Streams$ConcatSpliterator.forEachRemaining(Streams.java:735)
	at java.base/java.util.stream.Streams$ConcatSpliterator.forEachRemaining(Streams.java:734)
	at java.base/java.util.stream.ReferencePipeline$Head.forEach(ReferencePipeline.java:762)
	at org.junit.jupiter.engine.descriptor.ClassBasedTestDescriptor.invokeTestInstancePostProcessors(ClassBasedTestDescriptor.java:377)
	at org.junit.jupiter.engine.descriptor.ClassBasedTestDescriptor.lambda$instantiateAndPostProcessTestInstance$6(ClassBasedTestDescriptor.java:290)
	at org.junit.platform.engine.support.hierarchical.ThrowableCollector.execute(ThrowableCollector.java:73)
	at org.junit.jupiter.engine.descriptor.ClassBasedTestDescriptor.instantiateAndPostProcessTestInstance(ClassBasedTestDescriptor.java:289)
	at org.junit.jupiter.engine.descriptor.ClassBasedTestDescriptor.lambda$testInstancesProvider$4(ClassBasedTestDescriptor.java:279)
	at java.base/java.util.Optional.orElseGet(Optional.java:364)
	at org.junit.jupiter.engine.descriptor.ClassBasedTestDescriptor.lambda$testInstancesProvider$5(ClassBasedTestDescriptor.java:278)
	at org.junit.jupiter.engine.execution.TestInstancesProvider.getTestInstances(TestInstancesProvider.java:31)
	at org.junit.jupiter.engine.descriptor.TestMethodTestDescriptor.lambda$prepare$0(TestMethodTestDescriptor.java:106)
	at org.junit.platform.engine.support.hierarchical.ThrowableCollector.execute(ThrowableCollector.java:73)
	at org.junit.jupiter.engine.descriptor.TestMethodTestDescriptor.prepare(TestMethodTestDescriptor.java:105)
	at org.junit.jupiter.engine.descriptor.TestMethodTestDescriptor.prepare(TestMethodTestDescriptor.java:69)
	at org.junit.platform.engine.support.hierarchical.NodeTestTask.lambda$prepare$2(NodeTestTask.java:123)
	at org.junit.platform.engine.support.hierarchical.ThrowableCollector.execute(ThrowableCollector.java:73)
	at org.junit.platform.engine.support.hierarchical.NodeTestTask.prepare(NodeTestTask.java:123)
	at org.junit.platform.engine.support.hierarchical.NodeTestTask.execute(NodeTestTask.java:90)
	at java.base/java.util.ArrayList.forEach(ArrayList.java:1596)
	at org.junit.platform.engine.support.hierarchical.SameThreadHierarchicalTestExecutorService.invokeAll(SameThreadHierarchicalTestExecutorService.java:41)
	at org.junit.platform.engine.support.hierarchical.NodeTestTask.lambda$executeRecursively$6(NodeTestTask.java:155)
	at org.junit.platform.engine.support.hierarchical.ThrowableCollector.execute(ThrowableCollector.java:73)
	at org.junit.platform.engine.support.hierarchical.NodeTestTask.lambda$executeRecursively$8(NodeTestTask.java:141)
	at org.junit.platform.engine.support.hierarchical.Node.around(Node.java:137)
	at org.junit.platform.engine.support.hierarchical.NodeTestTask.lambda$executeRecursively$9(NodeTestTask.java:139)
	at org.junit.platform.engine.support.hierarchical.ThrowableCollector.execute(ThrowableCollector.java:73)
	at org.junit.platform.engine.support.hierarchical.NodeTestTask.executeRecursively(NodeTestTask.java:138)
	at org.junit.platform.engine.support.hierarchical.NodeTestTask.execute(NodeTestTask.java:95)
	at java.base/java.util.ArrayList.forEach(ArrayList.java:1596)
	at org.junit.platform.engine.support.hierarchical.SameThreadHierarchicalTestExecutorService.invokeAll(SameThreadHierarchicalTestExecutorService.java:41)
	at org.junit.platform.engine.support.hierarchical.NodeTestTask.lambda$executeRecursively$6(NodeTestTask.java:155)
	at org.junit.platform.engine.support.hierarchical.ThrowableCollector.execute(ThrowableCollector.java:73)
	at org.junit.platform.engine.support.hierarchical.NodeTestTask.lambda$executeRecursively$8(NodeTestTask.java:141)
	at org.junit.platform.engine.support.hierarchical.Node.around(Node.java:137)
	at org.junit.platform.engine.support.hierarchical.NodeTestTask.lambda$executeRecursively$9(NodeTestTask.java:139)
	at org.junit.platform.engine.support.hierarchical.ThrowableCollector.execute(ThrowableCollector.java:73)
	at org.junit.platform.engine.support.hierarchical.NodeTestTask.executeRecursively(NodeTestTask.java:138)
	at org.junit.platform.engine.support.hierarchical.NodeTestTask.execute(NodeTestTask.java:95)
	at org.junit.platform.engine.support.hierarchical.SameThreadHierarchicalTestExecutorService.submit(SameThreadHierarchicalTestExecutorService.java:35)
	at org.junit.platform.engine.support.hierarchical.HierarchicalTestExecutor.execute(HierarchicalTestExecutor.java:57)
	at org.junit.platform.engine.support.hierarchical.HierarchicalTestEngine.execute(HierarchicalTestEngine.java:54)
	at org.junit.platform.launcher.core.EngineExecutionOrchestrator.execute(EngineExecutionOrchestrator.java:198)
	at org.junit.platform.launcher.core.EngineExecutionOrchestrator.execute(EngineExecutionOrchestrator.java:169)
	at org.junit.platform.launcher.core.EngineExecutionOrchestrator.execute(EngineExecutionOrchestrator.java:93)
	at org.junit.platform.launcher.core.EngineExecutionOrchestrator.lambda$execute$0(EngineExecutionOrchestrator.java:58)
	at org.junit.platform.launcher.core.EngineExecutionOrchestrator.withInterceptedStreams(EngineExecutionOrchestrator.java:141)
	at org.junit.platform.launcher.core.EngineExecutionOrchestrator.execute(EngineExecutionOrchestrator.java:57)
	at org.junit.platform.launcher.core.DefaultLauncher.execute(DefaultLauncher.java:103)
	at org.junit.platform.launcher.core.DefaultLauncher.execute(DefaultLauncher.java:85)
	at org.junit.platform.launcher.core.DelegatingLauncher.execute(DelegatingLauncher.java:47)
	at org.apache.maven.surefire.junitplatform.LazyLauncher.execute(LazyLauncher.java:56)
	at org.apache.maven.surefire.junitplatform.JUnitPlatformProvider.execute(JUnitPlatformProvider.java:184)
	at org.apache.maven.surefire.junitplatform.JUnitPlatformProvider.invokeAllTests(JUnitPlatformProvider.java:148)
	at org.apache.maven.surefire.junitplatform.JUnitPlatformProvider.invoke(JUnitPlatformProvider.java:122)
	at org.apache.maven.surefire.booter.ForkedBooter.runSuitesInProcess(ForkedBooter.java:385)
	at org.apache.maven.surefire.booter.ForkedBooter.execute(ForkedBooter.java:162)
	at org.apache.maven.surefire.booter.ForkedBooter.run(ForkedBooter.java:507)
	at org.apache.maven.surefire.booter.ForkedBooter.main(ForkedBooter.java:495)
Caused by: org.springframework.beans.factory.BeanCreationException: Error creating bean with name 'entityManagerFactory' defined in class path resource [org/springframework/boot/autoconfigure/orm/jpa/HibernateJpaConfiguration.class]: Failed to initialize dependency 'flywayInitializer' of LoadTimeWeaverAware bean 'entityManagerFactory': Error creating bean with name 'flywayInitializer' defined in class path resource [org/springframework/boot/autoconfigure/flyway/FlywayAutoConfiguration$FlywayConfiguration.class]: Validate failed: Migrations have failed validation
Detected applied migration not resolved locally: 1.
If you removed this migration intentionally, run repair to mark the migration as deleted.
Need more flexibility with validation rules? Learn more: https://rd.gt/3AbJUZE
	at org.springframework.beans.factory.support.AbstractBeanFactory.doGetBean(AbstractBeanFactory.java:326)
	at org.springframework.beans.factory.support.AbstractBeanFactory.getBean(AbstractBeanFactory.java:205)
	at org.springframework.context.support.AbstractApplicationContext.finishBeanFactoryInitialization(AbstractApplicationContext.java:954)
	at org.springframework.context.support.AbstractApplicationContext.refresh(AbstractApplicationContext.java:625)
	at org.springframework.boot.SpringApplication.refresh(SpringApplication.java:754)
	at org.springframework.boot.SpringApplication.refreshContext(SpringApplication.java:456)
	at org.springframework.boot.SpringApplication.run(SpringApplication.java:335)
	at org.springframework.boot.test.context.SpringBootContextLoader.lambda$loadContext$3(SpringBootContextLoader.java:137)
	at org.springframework.util.function.ThrowingSupplier.get(ThrowingSupplier.java:58)
	at org.springframework.util.function.ThrowingSupplier.get(ThrowingSupplier.java:46)
	at org.springframework.boot.SpringApplication.withHook(SpringApplication.java:1463)
	at org.springframework.boot.test.context.SpringBootContextLoader$ContextLoaderHook.run(SpringBootContextLoader.java:553)
	at org.springframework.boot.test.context.SpringBootContextLoader.loadContext(SpringBootContextLoader.java:137)
	at org.springframework.boot.test.context.SpringBootContextLoader.loadContext(SpringBootContextLoader.java:108)
	at org.springframework.test.context.cache.DefaultCacheAwareContextLoaderDelegate.loadContextInternal(DefaultCacheAwareContextLoaderDelegate.java:225)
	at org.springframework.test.context.cache.DefaultCacheAwareContextLoaderDelegate.loadContext(DefaultCacheAwareContextLoaderDelegate.java:152)
	... 73 common frames omitted
Caused by: org.springframework.beans.factory.BeanCreationException: Error creating bean with name 'flywayInitializer' defined in class path resource [org/springframework/boot/autoconfigure/flyway/FlywayAutoConfiguration$FlywayConfiguration.class]: Validate failed: Migrations have failed validation
Detected applied migration not resolved locally: 1.
If you removed this migration intentionally, run repair to mark the migration as deleted.
Need more flexibility with validation rules? Learn more: https://rd.gt/3AbJUZE
	at org.springframework.beans.factory.support.AbstractAutowireCapableBeanFactory.initializeBean(AbstractAutowireCapableBeanFactory.java:1806)
	at org.springframework.beans.factory.support.AbstractAutowireCapableBeanFactory.doCreateBean(AbstractAutowireCapableBeanFactory.java:600)
	at org.springframework.beans.factory.support.AbstractAutowireCapableBeanFactory.createBean(AbstractAutowireCapableBeanFactory.java:522)
	at org.springframework.beans.factory.support.AbstractBeanFactory.lambda$doGetBean$0(AbstractBeanFactory.java:337)
	at org.springframework.beans.factory.support.DefaultSingletonBeanRegistry.getSingleton(DefaultSingletonBeanRegistry.java:234)
	at org.springframework.beans.factory.support.AbstractBeanFactory.doGetBean(AbstractBeanFactory.java:335)
	at org.springframework.beans.factory.support.AbstractBeanFactory.getBean(AbstractBeanFactory.java:200)
	at org.springframework.beans.factory.support.AbstractBeanFactory.doGetBean(AbstractBeanFactory.java:313)
	... 88 common frames omitted
Caused by: org.flywaydb.core.api.exception.FlywayValidateException: Validate failed: Migrations have failed validation
Detected applied migration not resolved locally: 1.
If you removed this migration intentionally, run repair to mark the migration as deleted.
Need more flexibility with validation rules? Learn more: https://rd.gt/3AbJUZE
	at org.flywaydb.core.Flyway.lambda$migrate$0(Flyway.java:160)
	at org.flywaydb.core.FlywayExecutor.execute(FlywayExecutor.java:205)
	at org.flywaydb.core.Flyway.migrate(Flyway.java:147)
	at org.springframework.boot.autoconfigure.flyway.FlywayMigrationInitializer.afterPropertiesSet(FlywayMigrationInitializer.java:66)
	at org.springframework.beans.factory.support.AbstractAutowireCapableBeanFactory.invokeInitMethods(AbstractAutowireCapableBeanFactory.java:1853)
	at org.springframework.beans.factory.support.AbstractAutowireCapableBeanFactory.initializeBean(AbstractAutowireCapableBeanFactory.java:1802)
	... 95 common frames omitted
[ERROR] Tests run: 1, Failures: 0, Errors: 1, Skipped: 0, Time elapsed: 9.732 s <<< FAILURE! -- in com.slifesys.sagnus.SagnusApplicationTests
[ERROR] com.slifesys.sagnus.SagnusApplicationTests.contextLoads -- Time elapsed: 0.012 s <<< ERROR!
java.lang.IllegalStateException: Failed to load ApplicationContext for [WebMergedContextConfiguration@2cc34cd5 testClass = com.slifesys.sagnus.SagnusApplicationTests, locations = [], classes = [com.slifesys.sagnus.SagnusApplication], contextInitializerClasses = [], activeProfiles = [], propertySourceDescriptors = [], propertySourceProperties = ["org.springframework.boot.test.context.SpringBootTestContextBootstrapper=true"], contextCustomizers = [org.springframework.boot.test.context.filter.ExcludeFilterContextCustomizer@5e3f861, org.springframework.boot.test.json.DuplicateJsonObjectContextCustomizerFactory$DuplicateJsonObjectContextCustomizer@6d5620ce, org.springframework.boot.test.mock.mockito.MockitoContextCustomizer@0, org.springframework.boot.test.web.client.TestRestTemplateContextCustomizer@3e78b6a5, org.springframework.boot.test.web.reactor.netty.DisableReactorResourceFactoryGlobalResourcesContextCustomizerFactory$DisableReactorResourceFactoryGlobalResourcesContextCustomizerCustomizer@4b8729ff, org.springframework.boot.test.autoconfigure.actuate.observability.ObservabilityContextCustomizerFactory$DisableObservabilityContextCustomizer@1f, org.springframework.boot.test.autoconfigure.properties.PropertyMappingContextCustomizer@0, org.springframework.boot.test.autoconfigure.web.servlet.WebDriverContextCustomizer@47c81abf, org.springframework.boot.test.context.SpringBootTestAnnotation@f8aaa1cc], resourceBasePath = "src/main/webapp", contextLoader = org.springframework.boot.test.context.SpringBootContextLoader, parent = null]
	at org.springframework.test.context.cache.DefaultCacheAwareContextLoaderDelegate.loadContext(DefaultCacheAwareContextLoaderDelegate.java:180)
	at org.springframework.test.context.support.DefaultTestContext.getApplicationContext(DefaultTestContext.java:130)
	at org.springframework.test.context.web.ServletTestExecutionListener.setUpRequestContextIfNecessary(ServletTestExecutionListener.java:191)
	at org.springframework.test.context.web.ServletTestExecutionListener.prepareTestInstance(ServletTestExecutionListener.java:130)
	at org.springframework.test.context.TestContextManager.prepareTestInstance(TestContextManager.java:260)
	at org.springframework.test.context.junit.jupiter.SpringExtension.postProcessTestInstance(SpringExtension.java:163)
	at java.base/java.util.stream.ReferencePipeline$3$1.accept(ReferencePipeline.java:197)
	at java.base/java.util.stream.ReferencePipeline$2$1.accept(ReferencePipeline.java:179)
	at java.base/java.util.ArrayList$ArrayListSpliterator.forEachRemaining(ArrayList.java:1708)
	at java.base/java.util.stream.AbstractPipeline.copyInto(AbstractPipeline.java:509)
	at java.base/java.util.stream.AbstractPipeline.wrapAndCopyInto(AbstractPipeline.java:499)
	at java.base/java.util.stream.StreamSpliterators$WrappingSpliterator.forEachRemaining(StreamSpliterators.java:310)
	at java.base/java.util.stream.Streams$ConcatSpliterator.forEachRemaining(Streams.java:735)
	at java.base/java.util.stream.Streams$ConcatSpliterator.forEachRemaining(Streams.java:734)
	at java.base/java.util.stream.ReferencePipeline$Head.forEach(ReferencePipeline.java:762)
	at java.base/java.util.Optional.orElseGet(Optional.java:364)
	at java.base/java.util.ArrayList.forEach(ArrayList.java:1596)
	at java.base/java.util.ArrayList.forEach(ArrayList.java:1596)
Caused by: org.springframework.beans.factory.BeanCreationException: Error creating bean with name 'entityManagerFactory' defined in class path resource [org/springframework/boot/autoconfigure/orm/jpa/HibernateJpaConfiguration.class]: Failed to initialize dependency 'flywayInitializer' of LoadTimeWeaverAware bean 'entityManagerFactory': Error creating bean with name 'flywayInitializer' defined in class path resource [org/springframework/boot/autoconfigure/flyway/FlywayAutoConfiguration$FlywayConfiguration.class]: Validate failed: Migrations have failed validation
Detected applied migration not resolved locally: 1.
If you removed this migration intentionally, run repair to mark the migration as deleted.
Need more flexibility with validation rules? Learn more: https://rd.gt/3AbJUZE
	at org.springframework.beans.factory.support.AbstractBeanFactory.doGetBean(AbstractBeanFactory.java:326)
	at org.springframework.beans.factory.support.AbstractBeanFactory.getBean(AbstractBeanFactory.java:205)
	at org.springframework.context.support.AbstractApplicationContext.finishBeanFactoryInitialization(AbstractApplicationContext.java:954)
	at org.springframework.context.support.AbstractApplicationContext.refresh(AbstractApplicationContext.java:625)
	at org.springframework.boot.SpringApplication.refresh(SpringApplication.java:754)
	at org.springframework.boot.SpringApplication.refreshContext(SpringApplication.java:456)
	at org.springframework.boot.SpringApplication.run(SpringApplication.java:335)
	at org.springframework.boot.test.context.SpringBootContextLoader.lambda$loadContext$3(SpringBootContextLoader.java:137)
	at org.springframework.util.function.ThrowingSupplier.get(ThrowingSupplier.java:58)
	at org.springframework.util.function.ThrowingSupplier.get(ThrowingSupplier.java:46)
	at org.springframework.boot.SpringApplication.withHook(SpringApplication.java:1463)
	at org.springframework.boot.test.context.SpringBootContextLoader$ContextLoaderHook.run(SpringBootContextLoader.java:553)
	at org.springframework.boot.test.context.SpringBootContextLoader.loadContext(SpringBootContextLoader.java:137)
	at org.springframework.boot.test.context.SpringBootContextLoader.loadContext(SpringBootContextLoader.java:108)
	at org.springframework.test.context.cache.DefaultCacheAwareContextLoaderDelegate.loadContextInternal(DefaultCacheAwareContextLoaderDelegate.java:225)
	at org.springframework.test.context.cache.DefaultCacheAwareContextLoaderDelegate.loadContext(DefaultCacheAwareContextLoaderDelegate.java:152)
	... 17 more
Caused by: org.springframework.beans.factory.BeanCreationException: Error creating bean with name 'flywayInitializer' defined in class path resource [org/springframework/boot/autoconfigure/flyway/FlywayAutoConfiguration$FlywayConfiguration.class]: Validate failed: Migrations have failed validation
Detected applied migration not resolved locally: 1.
If you removed this migration intentionally, run repair to mark the migration as deleted.
Need more flexibility with validation rules? Learn more: https://rd.gt/3AbJUZE
	at org.springframework.beans.factory.support.AbstractAutowireCapableBeanFactory.initializeBean(AbstractAutowireCapableBeanFactory.java:1806)
	at org.springframework.beans.factory.support.AbstractAutowireCapableBeanFactory.doCreateBean(AbstractAutowireCapableBeanFactory.java:600)
	at org.springframework.beans.factory.support.AbstractAutowireCapableBeanFactory.createBean(AbstractAutowireCapableBeanFactory.java:522)
	at org.springframework.beans.factory.support.AbstractBeanFactory.lambda$doGetBean$0(AbstractBeanFactory.java:337)
	at org.springframework.beans.factory.support.DefaultSingletonBeanRegistry.getSingleton(DefaultSingletonBeanRegistry.java:234)
	at org.springframework.beans.factory.support.AbstractBeanFactory.doGetBean(AbstractBeanFactory.java:335)
	at org.springframework.beans.factory.support.AbstractBeanFactory.getBean(AbstractBeanFactory.java:200)
	at org.springframework.beans.factory.support.AbstractBeanFactory.doGetBean(AbstractBeanFactory.java:313)
	... 32 more
Caused by: org.flywaydb.core.api.exception.FlywayValidateException: Validate failed: Migrations have failed validation
Detected applied migration not resolved locally: 1.
If you removed this migration intentionally, run repair to mark the migration as deleted.
Need more flexibility with validation rules? Learn more: https://rd.gt/3AbJUZE
	at org.flywaydb.core.Flyway.lambda$migrate$0(Flyway.java:160)
	at org.flywaydb.core.FlywayExecutor.execute(FlywayExecutor.java:205)
	at org.flywaydb.core.Flyway.migrate(Flyway.java:147)
	at org.springframework.boot.autoconfigure.flyway.FlywayMigrationInitializer.afterPropertiesSet(FlywayMigrationInitializer.java:66)
	at org.springframework.beans.factory.support.AbstractAutowireCapableBeanFactory.invokeInitMethods(AbstractAutowireCapableBeanFactory.java:1853)
	at org.springframework.beans.factory.support.AbstractAutowireCapableBeanFactory.initializeBean(AbstractAutowireCapableBeanFactory.java:1802)
	... 39 more

[INFO] 
[INFO] Results:
[INFO] 
[ERROR] Errors: 
[ERROR]   SagnusApplicationTests.contextLoads 轎 IllegalState Failed to load ApplicationContext for [WebMergedContextConfiguration@2cc34cd5 testClass = com.slifesys.sagnus.SagnusApplicationTests, locations = [], classes = [com.slifesys.sagnus.SagnusApplication], contextInitializerClasses = [], activeProfiles = [], propertySourceDescriptors = [], propertySourceProperties = ["org.springframework.boot.test.context.SpringBootTestContextBootstrapper=true"], contextCustomizers = [org.springframework.boot.test.context.filter.ExcludeFilterContextCustomizer@5e3f861, org.springframework.boot.test.json.DuplicateJsonObjectContextCustomizerFactory$DuplicateJsonObjectContextCustomizer@6d5620ce, org.springframework.boot.test.mock.mockito.MockitoContextCustomizer@0, org.springframework.boot.test.web.client.TestRestTemplateContextCustomizer@3e78b6a5, org.springframework.boot.test.web.reactor.netty.DisableReactorResourceFactoryGlobalResourcesContextCustomizerFactory$DisableReactorResourceFactoryGlobalResourcesContextCustomizerCustomizer@4b8729ff, org.springframework.boot.test.autoconfigure.actuate.observability.ObservabilityContextCustomizerFactory$DisableObservabilityContextCustomizer@1f, org.springframework.boot.test.autoconfigure.properties.PropertyMappingContextCustomizer@0, org.springframework.boot.test.autoconfigure.web.servlet.WebDriverContextCustomizer@47c81abf, org.springframework.boot.test.context.SpringBootTestAnnotation@f8aaa1cc], resourceBasePath = "src/main/webapp", contextLoader = org.springframework.boot.test.context.SpringBootContextLoader, parent = null]
[INFO] 
[ERROR] Tests run: 1, Failures: 0, Errors: 1, Skipped: 0
[INFO] 
[INFO] ------------------------------------------------------------------------
[INFO] BUILD FAILURE
[INFO] ------------------------------------------------------------------------
[INFO] Total time:  36.190 s
[INFO] Finished at: 2025-12-31T18:05:09-03:00
[INFO] ------------------------------------------------------------------------
[ERROR] Failed to execute goal org.apache.maven.plugins:maven-surefire-plugin:3.2.5:test (default-test) on project sagnus-api-gateway: 
[ERROR] 
[ERROR] Please refer to D:\Projetos\2025\Sagnus\ddd\sagnus\sagnus-api-gateway\target\surefire-reports for the individual test results.
[ERROR] Please refer to dump files (if any exist) [date].dump, [date]-jvmRun[N].dump and [date].dumpstream.
[ERROR] -> [Help 1]
[ERROR] 
[ERROR] To see the full stack trace of the errors, re-run Maven with the -e switch.
[ERROR] Re-run Maven using the -X switch to enable full debug logging.
[ERROR] 
[ERROR] For more information about the errors and possible solutions, please read the following articles:
[ERROR] [Help 1] http://cwiki.apache.org/confluence/display/MAVEN/MojoFailureException
